{
  "schema_version": "1.0",
  "decision_case_id": "DC_00103",
  "base_scenario_id": "SCN_0035",
  "step_index": 4,
  "placed_items": [
    {
      "item_id": "item_01",
      "geometry_id": "G_260x200x260",
      "dimensions_mm": {
        "length": 260,
        "width": 200,
        "height": 260
      },
      "mass_kg": 3.07,
      "weight_class": "light",
      "material": "Cardboard",
      "fragile": true,
      "stackable": true,
      "top_load_limit_kg_synthetic": 10.14,
      "product_category": "general",
      "pose": {
        "x_mm": 470.0,
        "y_mm": 400.0,
        "z_base_mm": 0.0,
        "yaw_deg": 0
      },
      "oriented_size_mm": [
        260.0,
        200.0,
        260.0
      ],
      "supported_load_kg": 0.0,
      "support_fractions": []
    },
    {
      "item_id": "item_02",
      "geometry_id": "G_260x200x260",
      "dimensions_mm": {
        "length": 260,
        "width": 200,
        "height": 260
      },
      "mass_kg": 3.07,
      "weight_class": "light",
      "material": "Cardboard",
      "fragile": true,
      "stackable": true,
      "top_load_limit_kg_synthetic": 10.14,
      "product_category": "general",
      "pose": {
        "x_mm": 210.0,
        "y_mm": 400.0,
        "z_base_mm": 0.0,
        "yaw_deg": 0
      },
      "oriented_size_mm": [
        260.0,
        200.0,
        260.0
      ],
      "supported_load_kg": 0.0,
      "support_fractions": []
    },
    {
      "item_id": "item_03",
      "geometry_id": "G_590x190x220",
      "dimensions_mm": {
        "length": 590,
        "width": 190,
        "height": 220
      },
      "mass_kg": 7.1,
      "weight_class": "medium",
      "material": "Cardboard",
      "fragile": false,
      "stackable": true,
      "top_load_limit_kg_synthetic": 15.41,
      "product_category": "general",
      "pose": {
        "x_mm": -215.0,
        "y_mm": 405.0,
        "z_base_mm": 0.0,
        "yaw_deg": 0
      },
      "oriented_size_mm": [
        590.0,
        190.0,
        220.0
      ],
      "supported_load_kg": 0.0,
      "support_fractions": []
    },
    {
      "item_id": "item_04",
      "geometry_id": "G_570x190x260",
      "dimensions_mm": {
        "length": 570,
        "width": 190,
        "height": 260
      },
      "mass_kg": 9.8,
      "weight_class": "heavy",
      "material": "Plastic",
      "fragile": false,
      "stackable": true,
      "top_load_limit_kg_synthetic": 61.95,
      "product_category": "electronics",
      "pose": {
        "x_mm": -205.0,
        "y_mm": 215.0,
        "z_base_mm": 0.0,
        "yaw_deg": 0
      },
      "oriented_size_mm": [
        570.0,
        190.0,
        260.0
      ],
      "supported_load_kg": 0.0,
      "support_fractions": []
    }
  ],
  "available_items": [
    {
      "item_id": "item_05",
      "geometry_id": "G_300x210x230",
      "dimensions_mm": {
        "length": 300,
        "width": 210,
        "height": 230
      },
      "mass_kg": 5.27,
      "weight_class": "light",
      "material": "Wood",
      "fragile": false,
      "stackable": true,
      "top_load_limit_kg_synthetic": 94.19,
      "product_category": "electronics"
    }
  ],
  "instruction_text": "电子产品箱不得与重物箱直接接触或形成上下支撑关系。",
  "candidate_set_id": "CSET_00103"
}
