{
  "schema_version": "1.0",
  "decision_case_id": "DC_00152",
  "base_scenario_id": "SCN_0051",
  "step_index": 6,
  "placed_items": [
    {
      "item_id": "item_01",
      "geometry_id": "G_395x390x170",
      "dimensions_mm": {
        "length": 395,
        "width": 390,
        "height": 170
      },
      "mass_kg": 7.42,
      "weight_class": "medium",
      "material": "Cardboard",
      "fragile": false,
      "stackable": true,
      "top_load_limit_kg_synthetic": 19.64,
      "product_category": "general",
      "pose": {
        "x_mm": 402.5,
        "y_mm": 305.0,
        "z_base_mm": 0.0,
        "yaw_deg": 0
      },
      "oriented_size_mm": [
        395.0,
        390.0,
        170.0
      ],
      "supported_load_kg": 0.0,
      "support_fractions": []
    },
    {
      "item_id": "item_02",
      "geometry_id": "G_395x390x170",
      "dimensions_mm": {
        "length": 395,
        "width": 390,
        "height": 170
      },
      "mass_kg": 7.42,
      "weight_class": "medium",
      "material": "Cardboard",
      "fragile": false,
      "stackable": true,
      "top_load_limit_kg_synthetic": 19.64,
      "product_category": "general",
      "pose": {
        "x_mm": 7.5,
        "y_mm": 305.0,
        "z_base_mm": 0.0,
        "yaw_deg": 0
      },
      "oriented_size_mm": [
        395.0,
        390.0,
        170.0
      ],
      "supported_load_kg": 0.0,
      "support_fractions": []
    },
    {
      "item_id": "item_03",
      "geometry_id": "G_395x390x170",
      "dimensions_mm": {
        "length": 395,
        "width": 390,
        "height": 170
      },
      "mass_kg": 7.42,
      "weight_class": "medium",
      "material": "Cardboard",
      "fragile": false,
      "stackable": true,
      "top_load_limit_kg_synthetic": 19.64,
      "product_category": "general",
      "pose": {
        "x_mm": -387.5,
        "y_mm": 305.0,
        "z_base_mm": 0.0,
        "yaw_deg": 0
      },
      "oriented_size_mm": [
        395.0,
        390.0,
        170.0
      ],
      "supported_load_kg": 0.0,
      "support_fractions": []
    },
    {
      "item_id": "item_04",
      "geometry_id": "G_395x390x170",
      "dimensions_mm": {
        "length": 395,
        "width": 390,
        "height": 170
      },
      "mass_kg": 7.42,
      "weight_class": "medium",
      "material": "Cardboard",
      "fragile": false,
      "stackable": true,
      "top_load_limit_kg_synthetic": 19.64,
      "product_category": "general",
      "pose": {
        "x_mm": 7.5,
        "y_mm": -85.0,
        "z_base_mm": 0.0,
        "yaw_deg": 0
      },
      "oriented_size_mm": [
        395.0,
        390.0,
        170.0
      ],
      "supported_load_kg": 0.0,
      "support_fractions": []
    },
    {
      "item_id": "item_05",
      "geometry_id": "G_560x390x140",
      "dimensions_mm": {
        "length": 560,
        "width": 390,
        "height": 140
      },
      "mass_kg": 9.54,
      "weight_class": "heavy",
      "material": "Cardboard",
      "fragile": true,
      "stackable": true,
      "top_load_limit_kg_synthetic": 11.47,
      "product_category": "general",
      "pose": {
        "x_mm": -385.0,
        "y_mm": -170.0,
        "z_base_mm": 0.0,
        "yaw_deg": 90
      },
      "oriented_size_mm": [
        390.0,
        560.0,
        140.0
      ],
      "supported_load_kg": 0.0,
      "support_fractions": []
    },
    {
      "item_id": "item_06",
      "geometry_id": "G_560x390x140",
      "dimensions_mm": {
        "length": 560,
        "width": 390,
        "height": 140
      },
      "mass_kg": 9.54,
      "weight_class": "heavy",
      "material": "Cardboard",
      "fragile": true,
      "stackable": true,
      "top_load_limit_kg_synthetic": 11.47,
      "product_category": "general",
      "pose": {
        "x_mm": 400.0,
        "y_mm": -170.0,
        "z_base_mm": 0.0,
        "yaw_deg": 90
      },
      "oriented_size_mm": [
        390.0,
        560.0,
        140.0
      ],
      "supported_load_kg": 0.0,
      "support_fractions": []
    }
  ],
  "available_items": [
    {
      "item_id": "item_07",
      "geometry_id": "G_590x380x230",
      "dimensions_mm": {
        "length": 590,
        "width": 380,
        "height": 230
      },
      "mass_kg": 6.36,
      "weight_class": "medium",
      "material": "Wood",
      "fragile": false,
      "stackable": true,
      "top_load_limit_kg_synthetic": 100.55,
      "product_category": "general"
    }
  ],
  "instruction_text": "易碎箱应尽量不承载其他箱体，并优先放在较高层。",
  "candidate_set_id": "CSET_00152"
}
