{
  "schema_version": "1.0",
  "decision_case_id": "DC_00035",
  "base_scenario_id": "SCN_0012",
  "step_index": 12,
  "placed_items": [
    {
      "item_id": "item_01",
      "geometry_id": "G_510x200x260",
      "dimensions_mm": {
        "length": 510,
        "width": 200,
        "height": 260
      },
      "mass_kg": 5.99,
      "weight_class": "medium",
      "material": "Cardboard",
      "fragile": false,
      "stackable": true,
      "top_load_limit_kg_synthetic": 6.63,
      "product_category": "general",
      "pose": {
        "x_mm": 345.0,
        "y_mm": 400.0,
        "z_base_mm": 0.0,
        "yaw_deg": 0
      },
      "oriented_size_mm": [
        510.0,
        200.0,
        260.0
      ],
      "supported_load_kg": 1.7,
      "support_fractions": []
    },
    {
      "item_id": "item_02",
      "geometry_id": "G_510x200x260",
      "dimensions_mm": {
        "length": 510,
        "width": 200,
        "height": 260
      },
      "mass_kg": 5.99,
      "weight_class": "medium",
      "material": "Cardboard",
      "fragile": false,
      "stackable": true,
      "top_load_limit_kg_synthetic": 6.63,
      "product_category": "general",
      "pose": {
        "x_mm": -165.0,
        "y_mm": 400.0,
        "z_base_mm": 0.0,
        "yaw_deg": 0
      },
      "oriented_size_mm": [
        510.0,
        200.0,
        260.0
      ],
      "supported_load_kg": 1.7,
      "support_fractions": []
    },
    {
      "item_id": "item_03",
      "geometry_id": "G_300x200x150",
      "dimensions_mm": {
        "length": 300,
        "width": 200,
        "height": 150
      },
      "mass_kg": 1.7,
      "weight_class": "light",
      "material": "Cardboard",
      "fragile": true,
      "stackable": false,
      "top_load_limit_kg_synthetic": 2.25,
      "product_category": "general",
      "pose": {
        "x_mm": -270.0,
        "y_mm": 400.0,
        "z_base_mm": 260.0,
        "yaw_deg": 0
      },
      "oriented_size_mm": [
        300.0,
        200.0,
        150.0
      ],
      "supported_load_kg": 0.0,
      "support_fractions": [
        {
          "item_id": "item_02",
          "fraction": 1.0
        }
      ]
    },
    {
      "item_id": "item_04",
      "geometry_id": "G_300x200x150",
      "dimensions_mm": {
        "length": 300,
        "width": 200,
        "height": 150
      },
      "mass_kg": 1.7,
      "weight_class": "light",
      "material": "Cardboard",
      "fragile": true,
      "stackable": false,
      "top_load_limit_kg_synthetic": 2.25,
      "product_category": "general",
      "pose": {
        "x_mm": 240.0,
        "y_mm": 400.0,
        "z_base_mm": 260.0,
        "yaw_deg": 0
      },
      "oriented_size_mm": [
        300.0,
        200.0,
        150.0
      ],
      "supported_load_kg": 0.0,
      "support_fractions": [
        {
          "item_id": "item_01",
          "fraction": 1.0
        }
      ]
    },
    {
      "item_id": "item_05",
      "geometry_id": "G_550x200x220",
      "dimensions_mm": {
        "length": 550,
        "width": 200,
        "height": 220
      },
      "mass_kg": 5.05,
      "weight_class": "light",
      "material": "Cardboard",
      "fragile": true,
      "stackable": true,
      "top_load_limit_kg_synthetic": 12.1,
      "product_category": "general",
      "pose": {
        "x_mm": 155.0,
        "y_mm": 200.0,
        "z_base_mm": 0.0,
        "yaw_deg": 0
      },
      "oriented_size_mm": [
        550.0,
        200.0,
        220.0
      ],
      "supported_load_kg": 5.05,
      "support_fractions": []
    },
    {
      "item_id": "item_06",
      "geometry_id": "G_550x200x220",
      "dimensions_mm": {
        "length": 550,
        "width": 200,
        "height": 220
      },
      "mass_kg": 5.05,
      "weight_class": "light",
      "material": "Cardboard",
      "fragile": true,
      "stackable": true,
      "top_load_limit_kg_synthetic": 12.1,
      "product_category": "general",
      "pose": {
        "x_mm": 155.0,
        "y_mm": 200.0,
        "z_base_mm": 220.0,
        "yaw_deg": 0
      },
      "oriented_size_mm": [
        550.0,
        200.0,
        220.0
      ],
      "supported_load_kg": 0.0,
      "support_fractions": [
        {
          "item_id": "item_05",
          "fraction": 1.0
        }
      ]
    },
    {
      "item_id": "item_07",
      "geometry_id": "G_540x270x250",
      "dimensions_mm": {
        "length": 540,
        "width": 270,
        "height": 250
      },
      "mass_kg": 7.7,
      "weight_class": "medium",
      "material": "Cardboard",
      "fragile": true,
      "stackable": true,
      "top_load_limit_kg_synthetic": 41.01,
      "product_category": "general",
      "pose": {
        "x_mm": 150.0,
        "y_mm": -35.0,
        "z_base_mm": 0.0,
        "yaw_deg": 0
      },
      "oriented_size_mm": [
        540.0,
        270.0,
        250.0
      ],
      "supported_load_kg": 3.7,
      "support_fractions": []
    },
    {
      "item_id": "item_08",
      "geometry_id": "G_600x200x180",
      "dimensions_mm": {
        "length": 600,
        "width": 200,
        "height": 180
      },
      "mass_kg": 3.7,
      "weight_class": "light",
      "material": "Cardboard",
      "fragile": true,
      "stackable": true,
      "top_load_limit_kg_synthetic": 10.8,
      "product_category": "general",
      "pose": {
        "x_mm": 120.0,
        "y_mm": -70.0,
        "z_base_mm": 250.0,
        "yaw_deg": 0
      },
      "oriented_size_mm": [
        600.0,
        200.0,
        180.0
      ],
      "supported_load_kg": 0.0,
      "support_fractions": [
        {
          "item_id": "item_07",
          "fraction": 1.0
        }
      ]
    },
    {
      "item_id": "item_09",
      "geometry_id": "G_540x200x220",
      "dimensions_mm": {
        "length": 540,
        "width": 200,
        "height": 220
      },
      "mass_kg": 5.07,
      "weight_class": "light",
      "material": "Cardboard",
      "fragile": true,
      "stackable": false,
      "top_load_limit_kg_synthetic": 20.79,
      "product_category": "general",
      "pose": {
        "x_mm": -280.0,
        "y_mm": 30.0,
        "z_base_mm": 0.0,
        "yaw_deg": 90
      },
      "oriented_size_mm": [
        200.0,
        540.0,
        220.0
      ],
      "supported_load_kg": 0.0,
      "support_fractions": []
    },
    {
      "item_id": "item_10",
      "geometry_id": "G_540x200x220",
      "dimensions_mm": {
        "length": 540,
        "width": 200,
        "height": 220
      },
      "mass_kg": 5.07,
      "weight_class": "light",
      "material": "Cardboard",
      "fragile": true,
      "stackable": false,
      "top_load_limit_kg_synthetic": 20.79,
      "product_category": "general",
      "pose": {
        "x_mm": -480.0,
        "y_mm": 30.0,
        "z_base_mm": 0.0,
        "yaw_deg": 90
      },
      "oriented_size_mm": [
        200.0,
        540.0,
        220.0
      ],
      "supported_load_kg": 0.0,
      "support_fractions": []
    },
    {
      "item_id": "item_11",
      "geometry_id": "G_380x240x160",
      "dimensions_mm": {
        "length": 380,
        "width": 240,
        "height": 160
      },
      "mass_kg": 3.47,
      "weight_class": "light",
      "material": "Cardboard",
      "fragile": false,
      "stackable": true,
      "top_load_limit_kg_synthetic": 18.24,
      "product_category": "electronics",
      "pose": {
        "x_mm": 10.0,
        "y_mm": -290.0,
        "z_base_mm": 0.0,
        "yaw_deg": 0
      },
      "oriented_size_mm": [
        380.0,
        240.0,
        160.0
      ],
      "supported_load_kg": 3.47,
      "support_fractions": []
    },
    {
      "item_id": "item_12",
      "geometry_id": "G_380x240x160",
      "dimensions_mm": {
        "length": 380,
        "width": 240,
        "height": 160
      },
      "mass_kg": 3.47,
      "weight_class": "light",
      "material": "Cardboard",
      "fragile": false,
      "stackable": true,
      "top_load_limit_kg_synthetic": 18.24,
      "product_category": "electronics",
      "pose": {
        "x_mm": 10.0,
        "y_mm": -290.0,
        "z_base_mm": 160.0,
        "yaw_deg": 0
      },
      "oriented_size_mm": [
        380.0,
        240.0,
        160.0
      ],
      "supported_load_kg": 0.0,
      "support_fractions": [
        {
          "item_id": "item_11",
          "fraction": 1.0
        }
      ]
    }
  ],
  "available_items": [
    {
      "item_id": "item_13",
      "geometry_id": "G_380x240x160",
      "dimensions_mm": {
        "length": 380,
        "width": 240,
        "height": 160
      },
      "mass_kg": 3.47,
      "weight_class": "light",
      "material": "Cardboard",
      "fragile": false,
      "stackable": true,
      "top_load_limit_kg_synthetic": 18.24,
      "product_category": "electronics"
    }
  ],
  "instruction_text": "电子产品箱应尽量集中码放。",
  "candidate_set_id": "CSET_00035"
}
